{
  "company_id": "borealis-demo-foods",
  "financials": [
    {
      "fact_id": "borealis-demo-foods:revenue_from_operations:FY2024",
      "metric": "revenue_from_operations",
      "label": "Revenue from operations",
      "value": 640.0,
      "unit": "INR crore",
      "period": "FY2024",
      "basis": "restated_consolidated",
      "kind": "reported",
      "formula": null,
      "inputs": [],
      "source": {
        "source_type": "SAMPLE",
        "document_id": "sample",
        "page": 212,
        "table": "Restated Consolidated Statement of Profit and Loss",
        "section": null,
        "url": "sample://demo-document",
        "sha256": null,
        "tier": "primary"
      },
      "extraction": {
        "method": "sample",
        "extracted_at": "2026-10-05T08:00:00+05:30",
        "extractor_version": "sample",
        "confidence": "high"
      },
      "status": "ok",
      "note": null,
      "supersedes": null
    },
    {
      "fact_id": "borealis-demo-foods:ebitda:FY2024",
      "metric": "ebitda",
      "label": "EBITDA",
      "value": 58.0,
      "unit": "INR crore",
      "period": "FY2024",
      "basis": "restated_consolidated",
      "kind": "reported",
      "formula": null,
      "inputs": [],
      "source": {
        "source_type": "SAMPLE",
        "document_id": "sample",
        "page": 212,
        "table": "Restated Consolidated Statement of Profit and Loss",
        "section": null,
        "url": "sample://demo-document",
        "sha256": null,
        "tier": "primary"
      },
      "extraction": {
        "method": "sample",
        "extracted_at": "2026-10-05T08:00:00+05:30",
        "extractor_version": "sample",
        "confidence": "high"
      },
      "status": "ok",
      "note": null,
      "supersedes": null
    },
    {
      "fact_id": "borealis-demo-foods:depreciation:FY2024",
      "metric": "depreciation",
      "label": "Depreciation & amortisation",
      "value": 19.0,
      "unit": "INR crore",
      "period": "FY2024",
      "basis": "restated_consolidated",
      "kind": "reported",
      "formula": null,
      "inputs": [],
      "source": {
        "source_type": "SAMPLE",
        "document_id": "sample",
        "page": 212,
        "table": "Restated Consolidated Statement of Profit and Loss",
        "section": null,
        "url": "sample://demo-document",
        "sha256": null,
        "tier": "primary"
      },
      "extraction": {
        "method": "sample",
        "extracted_at": "2026-10-05T08:00:00+05:30",
        "extractor_version": "sample",
        "confidence": "high"
      },
      "status": "ok",
      "note": null,
      "supersedes": null
    },
    {
      "fact_id": "borealis-demo-foods:ebit:FY2024",
      "metric": "ebit",
      "label": "EBIT",
      "value": 39.0,
      "unit": "INR crore",
      "period": "FY2024",
      "basis": "restated_consolidated",
      "kind": "reported",
      "formula": null,
      "inputs": [],
      "source": {
        "source_type": "SAMPLE",
        "document_id": "sample",
        "page": 212,
        "table": "Restated Consolidated Statement of Profit and Loss",
        "section": null,
        "url": "sample://demo-document",
        "sha256": null,
        "tier": "primary"
      },
      "extraction": {
        "method": "sample",
        "extracted_at": "2026-10-05T08:00:00+05:30",
        "extractor_version": "sample",
        "confidence": "high"
      },
      "status": "ok",
      "note": null,
      "supersedes": null
    },
    {
      "fact_id": "borealis-demo-foods:finance_cost:FY2024",
      "metric": "finance_cost",
      "label": "Finance cost",
      "value": 9.0,
      "unit": "INR crore",
      "period": "FY2024",
      "basis": "restated_consolidated",
      "kind": "reported",
      "formula": null,
      "inputs": [],
      "source": {
        "source_type": "SAMPLE",
        "document_id": "sample",
        "page": 212,
        "table": "Restated Consolidated Statement of Profit and Loss",
        "section": null,
        "url": "sample://demo-document",
        "sha256": null,
        "tier": "primary"
      },
      "extraction": {
        "method": "sample",
        "extracted_at": "2026-10-05T08:00:00+05:30",
        "extractor_version": "sample",
        "confidence": "high"
      },
      "status": "ok",
      "note": null,
      "supersedes": null
    },
    {
      "fact_id": "borealis-demo-foods:other_income:FY2024",
      "metric": "other_income",
      "label": "Other income",
      "value": 3.0,
      "unit": "INR crore",
      "period": "FY2024",
      "basis": "restated_consolidated",
      "kind": "reported",
      "formula": null,
      "inputs": [],
      "source": {
        "source_type": "SAMPLE",
        "document_id": "sample",
        "page": 212,
        "table": "Restated Consolidated Statement of Profit and Loss",
        "section": null,
        "url": "sample://demo-document",
        "sha256": null,
        "tier": "primary"
      },
      "extraction": {
        "method": "sample",
        "extracted_at": "2026-10-05T08:00:00+05:30",
        "extractor_version": "sample",
        "confidence": "high"
      },
      "status": "ok",
      "note": null,
      "supersedes": null
    },
    {
      "fact_id": "borealis-demo-foods:pbt:FY2024",
      "metric": "pbt",
      "label": "Profit before tax",
      "value": 33.0,
      "unit": "INR crore",
      "period": "FY2024",
      "basis": "restated_consolidated",
      "kind": "reported",
      "formula": null,
      "inputs": [],
      "source": {
        "source_type": "SAMPLE",
        "document_id": "sample",
        "page": 212,
        "table": "Restated Consolidated Statement of Profit and Loss",
        "section": null,
        "url": "sample://demo-document",
        "sha256": null,
        "tier": "primary"
      },
      "extraction": {
        "method": "sample",
        "extracted_at": "2026-10-05T08:00:00+05:30",
        "extractor_version": "sample",
        "confidence": "high"
      },
      "status": "ok",
      "note": null,
      "supersedes": null
    },
    {
      "fact_id": "borealis-demo-foods:tax:FY2024",
      "metric": "tax",
      "label": "Tax",
      "value": 8.2,
      "unit": "INR crore",
      "period": "FY2024",
      "basis": "restated_consolidated",
      "kind": "reported",
      "formula": null,
      "inputs": [],
      "source": {
        "source_type": "SAMPLE",
        "document_id": "sample",
        "page": 212,
        "table": "Restated Consolidated Statement of Profit and Loss",
        "section": null,
        "url": "sample://demo-document",
        "sha256": null,
        "tier": "primary"
      },
      "extraction": {
        "method": "sample",
        "extracted_at": "2026-10-05T08:00:00+05:30",
        "extractor_version": "sample",
        "confidence": "high"
      },
      "status": "ok",
      "note": null,
      "supersedes": null
    },
    {
      "fact_id": "borealis-demo-foods:pat:FY2024",
      "metric": "pat",
      "label": "Profit after tax",
      "value": 24.8,
      "unit": "INR crore",
      "period": "FY2024",
      "basis": "restated_consolidated",
      "kind": "reported",
      "formula": null,
      "inputs": [],
      "source": {
        "source_type": "SAMPLE",
        "document_id": "sample",
        "page": 212,
        "table": "Restated Consolidated Statement of Profit and Loss",
        "section": null,
        "url": "sample://demo-document",
        "sha256": null,
        "tier": "primary"
      },
      "extraction": {
        "method": "sample",
        "extracted_at": "2026-10-05T08:00:00+05:30",
        "extractor_version": "sample",
        "confidence": "high"
      },
      "status": "ok",
      "note": null,
      "supersedes": null
    },
    {
      "fact_id": "borealis-demo-foods:revenue_from_operations:FY2025",
      "metric": "revenue_from_operations",
      "label": "Revenue from operations",
      "value": 742.0,
      "unit": "INR crore",
      "period": "FY2025",
      "basis": "restated_consolidated",
      "kind": "reported",
      "formula": null,
      "inputs": [],
      "source": {
        "source_type": "SAMPLE",
        "document_id": "sample",
        "page": 212,
        "table": "Restated Consolidated Statement of Profit and Loss",
        "section": null,
        "url": "sample://demo-document",
        "sha256": null,
        "tier": "primary"
      },
      "extraction": {
        "method": "sample",
        "extracted_at": "2026-10-05T08:00:00+05:30",
        "extractor_version": "sample",
        "confidence": "high"
      },
      "status": "ok",
      "note": null,
      "supersedes": null
    },
    {
      "fact_id": "borealis-demo-foods:ebitda:FY2025",
      "metric": "ebitda",
      "label": "EBITDA",
      "value": 76.0,
      "unit": "INR crore",
      "period": "FY2025",
      "basis": "restated_consolidated",
      "kind": "reported",
      "formula": null,
      "inputs": [],
      "source": {
        "source_type": "SAMPLE",
        "document_id": "sample",
        "page": 212,
        "table": "Restated Consolidated Statement of Profit and Loss",
        "section": null,
        "url": "sample://demo-document",
        "sha256": null,
        "tier": "primary"
      },
      "extraction": {
        "method": "sample",
        "extracted_at": "2026-10-05T08:00:00+05:30",
        "extractor_version": "sample",
        "confidence": "high"
      },
      "status": "ok",
      "note": null,
      "supersedes": null
    },
    {
      "fact_id": "borealis-demo-foods:depreciation:FY2025",
      "metric": "depreciation",
      "label": "Depreciation & amortisation",
      "value": 22.0,
      "unit": "INR crore",
      "period": "FY2025",
      "basis": "restated_consolidated",
      "kind": "reported",
      "formula": null,
      "inputs": [],
      "source": {
        "source_type": "SAMPLE",
        "document_id": "sample",
        "page": 212,